<?xml version="1.0" encoding="UTF-8"?>
<items xmlns="stendhal" xmlns:xsi="http://www.w3.org/2001/XMLSchema-instance"
	xsi:schemaLocation="stendhal ../items.xsd ">
  <item name="leather helmet">
    <type class="helmet" subclass="leather_helmet" tileid="-1"/>
    <description>You see a leather helmet, it seems more like a hat than a defensive item.</description>
    <implementation class-name="games.stendhal.server.entity.item.Item"/>    <attributes>
      <def value="1"/>
    </attributes>
    <weight value="2.0"/>
    <value value="7"/>
    <equipable>
      <slot name="head"/>
      <slot name="bag"/>
    </equipable>
  </item>

  <item name="trophy helmet">
    <type class="helmet" subclass="golden_horned_barbute" tileid="-1"/>
    <description/>
    <implementation class-name="games.stendhal.server.entity.item.Item"/>    <attributes>
      <def value="1"/>
    </attributes>
    <weight value="10.0"/>
    <value value="7"/>
    <equipable>
      <slot name="head"/>
      <slot name="bag"/>
    </equipable>
  </item>

  <item name="robins hat">
    <type class="helmet" subclass="robins_hat" tileid="-1"/>
    <description>You see a robins hat. It's cute but that's about it.</description>
    <implementation class-name="games.stendhal.server.entity.item.Item"/>    <attributes>
      <def value="2"/>
    </attributes>
    <weight value="6.0"/>
    <value value="56"/>
    <equipable>
      <slot name="head"/>
      <slot name="bag"/>
    </equipable>
  </item>

  <item name="studded helmet">
    <type class="helmet" subclass="studded_helmet" tileid="-1"/>
    <description>You see a studded helmet, it should protect your head against cuts but perhaps not hard blows.</description>
    <implementation class-name="games.stendhal.server.entity.item.Item"/>    <attributes>
      <def value="2"/>
    </attributes>
    <weight value="3.0"/>
    <value value="56"/>
    <equipable>
      <slot name="head"/>
      <slot name="bag"/>
    </equipable>
  </item>

  <item name="chain helmet">
    <type class="helmet" subclass="chain_helmet" tileid="-1"/>
    <description>You see a solid chain helmet, it will be excellent protection for your head.</description>
    <implementation class-name="games.stendhal.server.entity.item.Item"/>    <attributes>
      <def value="4"/>
    </attributes>
    <weight value="6.0"/>
    <value value="448"/>
    <equipable>
      <slot name="head"/>
      <slot name="bag"/>
    </equipable>
  </item>

  <item name="viking helmet">
    <type class="helmet" subclass="horned_helmet" tileid="-1"/>
    <description>You see a viking helmet. The previous owner wore it to many battles.</description>
    <implementation class-name="games.stendhal.server.entity.item.Item"/>    <attributes>
      <def value="5"/>
    </attributes>
    <weight value="6.0"/>
    <value value="875"/>
    <equipable>
      <slot name="head"/>
      <slot name="bag"/>
    </equipable>
  </item>

  <item name="aventail">
    <type class="helmet" subclass="aventail" tileid="-1"/>
    <description>You see a aventail. It's a clever design.</description>
    <implementation class-name="games.stendhal.server.entity.item.Item"/>    <attributes>
      <def value="6"/>
    </attributes>
    <weight value="6.0"/>
    <value value="1512"/>
    <equipable>
      <slot name="head"/>
      <slot name="bag"/>
    </equipable>
  </item>

  <item name="red helmet">
    <type class="helmet" subclass="red_helmet" tileid="-1"/>
    <description>You see a red helmet, it reminds you of a jester's hat but you can be sure it has better protection than that.</description>
    <implementation class-name="games.stendhal.server.entity.item.Item"/>    <attributes>
      <def value="7"/>
    </attributes>
    <weight value="6.0"/>
    <value value="1512"/>
    <equipable>
      <slot name="head"/>
      <slot name="bag"/>
    </equipable>
  </item>

  <item name="blue helmet">
    <type class="helmet" subclass="blue_helmet" tileid="-1"/>
    <description>You see a brand new blue helmet.</description>
    <implementation class-name="games.stendhal.server.entity.item.Item"/>    <attributes>
      <def value="7"/>
    </attributes>
    <weight value="8.0"/>
    <value value="3012"/>
    <equipable>
      <slot name="head"/>
      <slot name="bag"/>
    </equipable>
  </item>

  <item name="golden helmet">
    <type class="helmet" subclass="golden_helmet" tileid="-1"/>
    <description>You see a heavy golden helmet. The thick metal should protect you against almost anything.</description>
    <implementation class-name="games.stendhal.server.entity.item.Item"/>    <attributes>
      <def value="9"/>
    </attributes>
    <weight value="15.0"/>
    <value value="5103"/>
    <equipable>
      <slot name="head"/>
      <slot name="bag"/>
    </equipable>
  </item>

  <item name="shadow helmet">
    <type class="helmet" subclass="shadow_helmet" tileid="-1"/>
    <description>You see a heavy shadow helmet. Instead of shining, it darkly gleams.</description>
    <implementation class-name="games.stendhal.server.entity.item.Item"/>    <attributes>
      <def value="10"/>
    </attributes>
    <weight value="15.0"/>
    <value value="7000"/>
    <susceptibility type="light" value="1.4"/>
    <susceptibility type="dark" value="0.85"/> 
    <equipable>
      <slot name="head"/>
      <slot name="bag"/>
    </equipable>
  </item>

  <item name="horned golden helmet">
    <type class="helmet" subclass="enhanced_golden_helmet" tileid="-1"/>
    <description>You see a horned golden helmet.</description>
    <implementation class-name="games.stendhal.server.entity.item.Item"/>    <attributes>
      <def value="12"/>
    </attributes>
    <weight value="15.0"/>
    <value value="12096"/>
    <equipable>
      <slot name="head"/>
      <slot name="bag"/>
    </equipable>
  </item>

  <item name="chaos helmet">
    <type class="helmet" subclass="chaos_helmet" tileid="-1"/>
    <description>You see a chaos helmet.</description>
    <implementation class-name="games.stendhal.server.entity.item.Item"/>    <attributes>
      <def value="14"/>
    </attributes>
    <weight value="15.0"/>
    <value value="19208"/>
    <equipable>
      <slot name="bag"/>
      <slot name="head"/>
    </equipable>
  </item>

  <item name="mainio helmet">
    <type class="helmet" subclass="lion_clan_helmet" tileid="-1"/>
    <description>You see a strange mainio helmet. You can barely see when wearing it, but it protects your head very well.</description>
    <implementation class-name="games.stendhal.server.entity.item.Item"/>    <attributes>
      <def value="16"/>
    </attributes>
    <weight value="15.0"/>
    <value value="39208"/>
    <equipable>
      <slot name="bag"/>
      <slot name="head"/>
    </equipable>
  </item>

  <item name="magic chain helmet">
    <type class="helmet" subclass="magic_chain_helmet" tileid="-1"/>
    <description>You see a magic chain helmet.</description>
    <implementation class-name="games.stendhal.server.entity.item.Item"/>    <attributes>
      <def value="22"/>
    </attributes>
    <weight value="15.0"/>
    <value value="74536"/>
    <susceptibility type="fire" value="0.98"/>
    <susceptibility type="ice" value="0.98"/>
    <susceptibility type="dark" value="0.98"/>
    <susceptibility type="light" value="0.98"/>
    <equipable>
      <slot name="head"/>
      <slot name="bag"/>
    </equipable>
  </item>

  <item name="liberty helmet">
    <type class="helmet" subclass="liberty_helmet" tileid="-1"/>
    <description>You see the liberty helmet. It's light and strong, you feel free wearing it.</description>
    <implementation class-name="games.stendhal.server.entity.item.Item"/>    <attributes>
      <def value="24"/>
    </attributes>
    <weight value="5.0"/>
    <value value="100208"/>
    <equipable>
      <slot name="bag"/>
      <slot name="head"/>
    </equipable>
  </item>

  <item name="black helmet">
    <type class="helmet" subclass="black_helmet" tileid="-1"/>
    <description>You see a black helmet.</description>
    <implementation class-name="games.stendhal.server.entity.item.Item"/>    <attributes>
      <def value="26"/>
    </attributes>
    <weight value="15.0"/>
    <value value="123032"/>
    <susceptibility type="light" value="1.3"/>
    <susceptibility type="dark" value="0.85"/> 
    <equipable>
      <slot name="bag"/>
      <slot name="head"/>
    </equipable>
  </item>
 
  <item name="mithril helmet">
    <type class="helmet" subclass="mithril_helmet" tileid="-1"/>
    <description>You see a mithril helmet.</description>
    <implementation class-name="games.stendhal.server.entity.item.Item"/>    <attributes>
      <def value="29"/>
    </attributes>
    <weight value="12.0"/>
    <value value="323032"/>
    <susceptibility type="light" value="0.9"/>
    <susceptibility type="dark" value="1.3"/> 
    <equipable>
      <slot name="bag"/>
      <slot name="head"/>
    </equipable>
  </item>
</items>
