<?xml version="1.0" encoding="UTF-8"?>
<items xmlns="stendhal" xmlns:xsi="http://www.w3.org/2001/XMLSchema-instance"
	xsi:schemaLocation="stendhal ../items.xsd ">
  <item name="lucky charm">
    <type class="special" subclass="lucky_charm" tileid="-1"/>
    <description>You see a lucky charm. Some believe that it helps their karma in some way, but others think that is superstition.</description>
    <implementation class-name="games.stendhal.server.entity.item.StackableItem"/>
    <attributes>
      <quantity value="1"/>
      <max_quantity value="2147483647"/>
      <autobind value=""/>
    </attributes>
    <weight value="1.0"/>
    <value value="100000"/>
    <equipable>
      <slot name="ground"/>
      <slot name="content"/>
      <slot name="lhand"/>
      <slot name="rhand"/>
      <slot name="keyring"/>
      <slot name="bag"/>
      <slot name="trade"/>
    </equipable>
  </item>


   <item name="mithril clasp">
    <type class="special" subclass="mithril_clasp" tileid="-1"/>
    <description>You see a clasp made from mithril, it would provide the fastening for a cloak.</description>
    <implementation class-name="games.stendhal.server.entity.item.Item"/>    <attributes>
    </attributes>
    <weight value="1.0"/>
    <value value="200000"/>
    <equipable>
      <slot name="ground"/>
      <slot name="content"/>
      <slot name="bag"/>
      <slot name="trade"/>
      <slot name="lhand"/>
      <slot name="rhand"/>
    </equipable>
  </item>

  <item name="mythical egg">
    <type class="special" subclass="mythical_egg" tileid="-1"/>
    <description>You see a mythical egg, but you do not know, what it is for.</description>
    <implementation class-name="games.stendhal.server.entity.item.StackableItem"/>    <attributes>
      <quantity value="1"/>
      <max_quantity value="2147483647"/>
    </attributes>
    <weight value="1.0"/>
    <value value="100000"/>
    <equipable>
      <slot name="ground"/>
      <slot name="content"/>
      <slot name="lhand"/>
      <slot name="rhand"/>
      <slot name="bag"/>
      <slot name="trade"/>
    </equipable>
  </item>


  <item name="magical eggshells">
    <type class="special" subclass="eggshells" tileid="-1"/>
    <description>You see shards from a mythical egg. They have magical properties.</description>
    <implementation class-name="games.stendhal.server.entity.item.StackableItem"/>
    <attributes>
      <quantity value="1"/>
      <max_quantity value="2147483647"/>
    </attributes>
    <weight value="0.01"/>
    <value value="1000"/>
    <equipable>
      <slot name="ground"/>
      <slot name="content"/>
      <slot name="bag"/>
      <slot name="trade"/>
      <slot name="lhand"/>
      <slot name="rhand"/>
    </equipable>
  </item>

  <item name="golden gm token">
    <type class="special" subclass="GM_tokend_gold2" tileid="-1"/>
    <description/>
    <implementation class-name="games.stendhal.server.entity.item.StackableItem"/>
    <attributes>
      <quantity value="1"/>
      <max_quantity value="2147483647"/>
    </attributes>
    <weight value="0.01"/>
    <value value="1"/>
    <equipable>
      <slot name="ground"/>
      <slot name="content"/>
      <slot name="lhand"/>
      <slot name="rhand"/>
      <slot name="bag"/>
      <slot name="trade"/>
    </equipable>
  </item>

  <item name="silvery gm token">
    <type class="special" subclass="GM_tokend_silver" tileid="-1"/>
    <description/>
    <implementation class-name="games.stendhal.server.entity.item.StackableItem"/>
    <attributes>
      <quantity value="1"/>
      <max_quantity value="2147483647"/>
    </attributes>
    <weight value="0.01"/>
    <value value="1"/>
    <equipable>
      <slot name="ground"/>
      <slot name="content"/>
      <slot name="lhand"/>
      <slot name="rhand"/>
      <slot name="bag"/>
      <slot name="trade"/>
    </equipable>
  </item>

  <item name="bronze gm token">
    <type class="special" subclass="GM_tokend_bronze" tileid="-1"/>
    <description/>
    <implementation class-name="games.stendhal.server.entity.item.StackableItem"/>
    <attributes>
      <quantity value="1"/>
      <max_quantity value="2147483647"/>
    </attributes>
    <weight value="0.01"/>
    <value value="1"/>
    <equipable>
      <slot name="ground"/>
      <slot name="content"/>
      <slot name="lhand"/>
      <slot name="rhand"/>
      <slot name="bag"/>
      <slot name="trade"/>
    </equipable>
  </item>
  
  <item name="crystal of anger">
    <type class="special" subclass="crystal_red" tileid="-1" />
    <description>You see a #crystal #of #anger.</description>
    <implementation class-name="games.stendhal.server.entity.item.Item" />
    <attributes>
      <quantity value="1" />
      <max_quantity value="2147483647" />
    </attributes>
    <weight value="0.1" />
    <value value="100" />
    <equipable>
      <slot name="ground" />
      <slot name="content" />
      <slot name="lhand" />
      <slot name="rhand" />
      <slot name="head" />
      <slot name="bag" />
    </equipable>
  </item>
  
  <item name="crystal of fear">
    <type class="special" subclass="crystal_purple" tileid="-1" />
    <description>You see a #crystal #of #fear.</description>
    <implementation class-name="games.stendhal.server.entity.item.Item" />
    <attributes>
      <quantity value="1" />
      <max_quantity value="2147483647" />
    </attributes>
    <weight value="0.1" />
    <value value="100" />
    <equipable>
      <slot name="ground" />
      <slot name="content" />
      <slot name="lhand" />
      <slot name="rhand" />
      <slot name="head" />
      <slot name="bag" />
    </equipable>
  </item>
  
  <item name="crystal of joy">
    <type class="special" subclass="crystal_yellow" tileid="-1" />
    <description>You see a #crystal #of #joy.</description>
    <implementation class-name="games.stendhal.server.entity.item.Item" />
    <attributes>
      <quantity value="1" />
      <max_quantity value="2147483647" />
    </attributes>
    <weight value="0.1" />
    <value value="100" />
    <equipable>
      <slot name="ground" />
      <slot name="content" />
      <slot name="lhand" />
      <slot name="rhand" />
      <slot name="head" />
      <slot name="bag" />
    </equipable>
  </item>
  
  <item name="crystal of love">
    <type class="special" subclass="crystal_pink" tileid="-1" />
    <description>You see a #crystal #of #love.</description>
    <implementation class-name="games.stendhal.server.entity.item.Item" />
    <attributes>
      <quantity value="1" />
      <max_quantity value="2147483647" />
    </attributes>
    <weight value="0.1" />
    <value value="100" />
    <equipable>
      <slot name="ground" />
      <slot name="content" />
      <slot name="lhand" />
      <slot name="rhand" />
      <slot name="head" />
      <slot name="bag" />
    </equipable>
  </item>
  
  <item name="crystal of peace">
    <type class="special" subclass="crystal_blue" tileid="-1" />
    <description>You see a #crystal #of #love.</description>
    <implementation class-name="games.stendhal.server.entity.item.Item" />
    <attributes>
      <quantity value="1" />
      <max_quantity value="2147483647" />
    </attributes>
    <weight value="0.1" />
    <value value="100" />
    <equipable>
      <slot name="ground" />
      <slot name="content" />
      <slot name="lhand" />
      <slot name="rhand" />
      <slot name="head" />
      <slot name="bag" />
    </equipable>
  </item>
  
</items>
