<?xml version="1.0" encoding="UTF-8" standalone="no"?>

<items xmlns="stendhal" xmlns:xsi="http://www.w3.org/2001/XMLSchema-instance"
    xsi:schemaLocation="stendhal ../items.xsd">

  <item name="money">
    <type class="money" subclass="gold" tileid="-1"/>
    <description/>
    <implementation class-name="games.stendhal.server.entity.item.Money"/>
    <attributes>
      <quantity value="1"/>
    </attributes>
    <weight value="0.01"/>
    <value value="1"/>
    <equipable>
      <slot name="ground"/>
      <slot name="content"/>
      <slot name="bag"/>
      <slot name="trade"/>
      <slot name="lhand"/>
      <slot name="rhand"/>
      <slot name="pouch"/>
    </equipable>
  </item>

</items>
