<?xml version="1.0" encoding="UTF-8"?>
<items xmlns="stendhal" xmlns:xsi="http://www.w3.org/2001/XMLSchema-instance"
	xsi:schemaLocation="stendhal ../items.xsd ">
  <item name="leather legs">
    <type class="legs" subclass="leather_legs" tileid="-1"/>
    <description>You see a pair of leather legs. They look new but they're poor quality.</description>
    <implementation class-name="games.stendhal.server.entity.item.Item"/>    <attributes>
      <def value="1"/>
    </attributes>
    <weight value="10.0"/>
    <value value="7"/>
    <equipable>
      <slot name="legs"/>
      <slot name="bag"/>
    </equipable>
  </item>

  <item name="studded legs">
    <type class="legs" subclass="studded_legs" tileid="-1"/>
    <description>You see a pair of blood stained studded legs. You're not sure if the blood came from their last owner ... or his enemies.</description>
    <implementation class-name="games.stendhal.server.entity.item.Item"/>    <attributes>
      <def value="2"/>
    </attributes>
    <weight value="12.0"/>
    <value value="56"/>
    <equipable>
      <slot name="legs"/>
      <slot name="bag"/>
    </equipable>
  </item>

  <item name="chain legs">
    <type class="legs" subclass="chain_legs" tileid="-1"/>
    <description>You see a pair of well made chain legs. They should protect you against any attacks aimed low.</description>
    <implementation class-name="games.stendhal.server.entity.item.Item"/>    <attributes>
      <def value="4"/>
    </attributes>
    <weight value="15.0"/>
    <value value="448"/>
    <equipable>
      <slot name="legs"/>
      <slot name="bag"/>
    </equipable>
  </item>

  <item name="red legs">
    <type class="legs" subclass="red_legs" tileid="-1"/>
    <description>A pair of red legs are in your grasp.</description>
    <implementation class-name="games.stendhal.server.entity.item.Item"/>    <attributes>
      <def value="5"/>
    </attributes>
    <weight value="12.0"/>
    <value value="1512"/>
    <equipable>
      <slot name="legs"/>
      <slot name="bag"/>
    </equipable>
  </item>

  <item name="elvish legs">
    <type class="legs" subclass="elvish_legs" tileid="-1"/>
    <description>You see a pair of elvish legs.</description>
    <implementation class-name="games.stendhal.server.entity.item.Item"/>    <attributes>
      <def value="6"/>
    </attributes>
    <weight value="12.0"/>
    <value value="1512"/>
    <equipable>
      <slot name="legs"/>
      <slot name="bag"/>
    </equipable>
  </item>

  <item name="blue legs">
    <type class="legs" subclass="blue_legs" tileid="-1"/>
    <description>You see a pair of shiny new blue legs.</description>
    <implementation class-name="games.stendhal.server.entity.item.Item"/>    <attributes>
      <def value="7"/>
    </attributes>
    <weight value="12.0"/>
    <value value="1512"/>
    <equipable>
      <slot name="legs"/>
      <slot name="bag"/>
    </equipable>
  </item>

  <item name="golden legs">
    <type class="legs" subclass="golden_legs" tileid="-1"/>
    <description>You see a pair of shining, strong golden legs.</description>
    <implementation class-name="games.stendhal.server.entity.item.Item"/>    <attributes>
      <def value="8"/>
    </attributes>
    <weight value="25.0"/>
    <value value="3584"/>
    <equipable>
      <slot name="legs"/>
      <slot name="bag"/>
    </equipable>
  </item>

  <item name="shadow legs">
    <type class="legs" subclass="shadow_legs" tileid="-1"/>
    <description>You see a pair of shadow legs. The weight of them is incredible.</description>
    <implementation class-name="games.stendhal.server.entity.item.Item"/>    <attributes>
      <def value="9"/>
    </attributes>
    <weight value="25.0"/>
    <value value="5103"/>
    <susceptibility type="light" value="1.4"/>
    <susceptibility type="dark" value="0.9"/>
    <equipable>
      <slot name="legs"/>
      <slot name="bag"/>
    </equipable>
  </item>

  <item name="mainio legs">
    <type class="legs" subclass="mainio_legs" tileid="-1"/>
    <description>You see a pair of odd looking mainio legs. They are somewhat startling but they give you a good protection.</description>
    <implementation class-name="games.stendhal.server.entity.item.Item"/>    <attributes>
      <def value="10"/>
    </attributes>
    <weight value="25.0"/>
    <value value="7317"/>
    <equipable>
      <slot name="bag"/>
      <slot name="legs"/>
    </equipable>
  </item>

  <item name="chaos legs">
    <type class="legs" subclass="chaos_legs" tileid="-1"/>
    <description>You see a pair of chaos legs. The strange colours confuse you.</description>
    <implementation class-name="games.stendhal.server.entity.item.Item"/>    <attributes>
      <def value="11"/>
    </attributes>
    <weight value="25.0"/>
    <value value="9317"/>
    <equipable>
      <slot name="bag"/>
      <slot name="legs"/>
    </equipable>
  </item>

  <item name="xeno legs">
    <type class="legs" subclass="xeno_legs" tileid="-1"/>
    <description>You see a pair of xeno legs. They're very strong and look brand new.</description>
    <implementation class-name="games.stendhal.server.entity.item.Item"/>    <attributes>
      <def value="11"/>
    </attributes>
    <weight value="25.0"/>
    <value value="10017"/>
    <equipable>
      <slot name="bag"/>
      <slot name="legs"/>
    </equipable>
  </item>

  <item name="jewelled legs">
    <type class="legs" subclass="jewelled_legs" tileid="-1"/>
    <description>You see a beautiful pair of jewelled legs. A large red gem glints at you and they're encrusted all over with sapphires.</description>
    <implementation class-name="games.stendhal.server.entity.item.Item"/>    <attributes>
      <def value="13"/>
    </attributes>
    <weight value="25.0"/>
    <value value="15017"/>
    <equipable>
      <slot name="bag"/>
      <slot name="legs"/>
    </equipable>
  </item>

  <item name="black legs">
    <type class="legs" subclass="black_legs" tileid="-1"/>
    <description>You see a pair of black legs.</description>
    <implementation class-name="games.stendhal.server.entity.item.Item"/>    <attributes>
      <def value="15"/>
    </attributes>
    <weight value="25.0"/>
    <value value="23625"/>
    <susceptibility type="light" value="1.2"/>
    <susceptibility type="dark" value="0.95"/>
    <equipable>
      <slot name="bag"/>
      <slot name="legs"/>
    </equipable>
  </item>

  <item name="mithril legs">
    <type class="legs" subclass="mithril_legs" tileid="-1"/>
    <description>You see a pair of mithril legs. They will serve you well.</description>
    <implementation class-name="games.stendhal.server.entity.item.Item"/>    <attributes>
      <def value="18"/>
    </attributes>
    <weight value="22.0"/>
    <value value="53625"/>
    <susceptibility type="light" value="0.9"/>
    <susceptibility type="dark" value="1.3"/>
    <equipable>
      <slot name="bag"/>
      <slot name="legs"/>
    </equipable>
  </item>
</items>
