<?xml version="1.0" encoding="UTF-8"?>
<items xmlns="stendhal" xmlns:xsi="http://www.w3.org/2001/XMLSchema-instance"
	xsi:schemaLocation="stendhal ../items.xsd ">
  <item name="flask">
    <type class="container" subclass="bottle" tileid="-1"/>
    <description>You see a flask. This flask is good for storing medicine.</description>
    <implementation class-name="games.stendhal.server.entity.item.StackableItem"/>    <attributes>
      <quantity value="1"/>
    </attributes>
    <weight value="1.0"/>
    <value value="1"/>
    <equipable>
      <slot name="bag"/>
      <slot name="trade"/>
    </equipable>
  </item>

  <item name="bottle">
    <type class="container" subclass="bottle" tileid="-1"/>
    <description>You see a bottle. It is empty, someone drank the contents</description>
    <implementation class-name="games.stendhal.server.entity.item.StackableItem"/>    <attributes>
      <quantity value="1"/>
    </attributes>
    <weight value="1.0"/>
    <value value="1"/>
    <equipable>
      <slot name="bag"/>
      <slot name="trade"/>
    </equipable>
  </item>

  <item name="big bottle">
    <type class="container" subclass="big_bottle" tileid="-1"/>
    <description>You see a big bottle.</description>
    <implementation class-name="games.stendhal.server.entity.item.StackableItem"/>    <attributes>
      <quantity value="1"/>
    </attributes>
    <weight value="1.0"/>
    <value value="1"/>
    <equipable>
      <slot name="bag"/>
      <slot name="trade"/>
    </equipable>
  </item>

  <item name="empty goblet">
    <type class="container" subclass="empty_goblet" tileid="-1"/>
    <description>You see an empty goblet.  You wonder what could it hold.</description>
    <implementation class-name="games.stendhal.server.entity.item.Item"/>    <attributes>
    </attributes>
    <weight value="1.0"/>
    <value value="1"/>
    <equipable>
      <slot name="bag"/>
      <slot name="trade"/>
    </equipable>
  </item>

  <item name="goblet">
    <type class="container" subclass="full_goblet" tileid="-1"/>
    <description>You see a goblet.  You look at its contents, and shiver at the blood inside.</description>
    <implementation class-name="games.stendhal.server.entity.item.StackableItem"/>    <attributes>
      <quantity value="1"/>
    </attributes>
    <weight value="1.0"/>
    <value value="1"/>
    <equipable>
      <slot name="bag"/>
      <slot name="trade"/>
    </equipable>
  </item>
</items>