<?xml version="1.0" encoding="UTF-8" standalone="no"?>

<items xmlns="stendhal" xmlns:xsi="http://www.w3.org/2001/XMLSchema-instance"
    xsi:schemaLocation="stendhal ../items.xsd">

  <item name="present">
    <type class="box" subclass="present" tileid="-1"/>
    <description>You see a present. Open it.</description>
    <implementation class-name="games.stendhal.server.entity.item.Present"/>
    <attributes>
    </attributes>
    <weight value="0.01"/>
    <value value="1"/>
    <equipable>
      <slot name="ground"/>
      <slot name="content"/>
      <slot name="bag"/>
      <slot name="trade"/>
    </equipable>
  </item>

  <item name="basket">
    <type class="box" subclass="basket" tileid="-1"/>
    <description>You see an easter basket. Look inside.</description>
    <implementation class-name="games.stendhal.server.entity.item.Basket"/>
    <attributes>
    </attributes>
    <weight value="0.01"/>
    <value value="1"/>
    <equipable>
      <slot name="ground"/>
      <slot name="content"/>
      <slot name="bag"/>
      <slot name="trade"/>
    </equipable>
  </item>

  <item name="stocking">
    <type class="box" subclass="stocking" tileid="-1"/>
    <description>You see a christmas stocking. Look inside.</description>
    <implementation class-name="games.stendhal.server.entity.item.Stocking"/>
    <attributes>
    </attributes>
    <weight value="0.01"/>
    <value value="100"/>
    <equipable>
      <slot name="ground"/>
      <slot name="content"/>
      <slot name="bag"/>
      <slot name="trade"/>
    </equipable>
  </item>

</items>
