<?xml version="1.0" encoding="UTF-8"?>
<items xmlns="stendhal" xmlns:xsi="http://www.w3.org/2001/XMLSchema-instance"
	xsi:schemaLocation="stendhal ../items.xsd ">
  <item name="arandula">
    <type class="herb" subclass="arandula" tileid="-1"/>
    <description>You see a arandula. It has medicinal properties, if the right person uses it.</description>
    <implementation class-name="games.stendhal.server.entity.item.StackableItem"/>    <attributes>
      <quantity value="1"/>
    </attributes>
    <weight value="0.01"/>
    <value value="1"/>
    <equipable>
      <slot name="lhand"/>
      <slot name="rhand"/>
      <slot name="bag"/>
      <slot name="trade"/>
    </equipable>
  </item>

  <item name="kokuda">
    <type class="herb" subclass="kokuda" tileid="-1"/>
    <description>You see a kokuda. It has medicinal properties, if the right person uses it.</description>
    <implementation class-name="games.stendhal.server.entity.item.StackableItem"/>    <attributes>
      <quantity value="1"/>
    </attributes>
    <weight value="0.01"/>
    <value value="1"/>
    <equipable>
      <slot name="lhand"/>
      <slot name="rhand"/>
      <slot name="bag"/>
      <slot name="trade"/>
    </equipable>
  </item>

  <item name="kekik">
    <type class="herb" subclass="kekik" tileid="-1"/>
    <description>You see a kekik. It is a herb which can have healing properties.</description>
    <implementation class-name="games.stendhal.server.entity.item.StackableItem"/>    <attributes>
      <quantity value="1"/>
    </attributes>
    <weight value="0.01"/>
    <value value="1"/>
    <equipable>
      <slot name="lhand"/>
      <slot name="rhand"/>
      <slot name="bag"/>
      <slot name="trade"/>
    </equipable>
  </item>

  <item name="mandragora">
    <type class="herb" subclass="mandragora" tileid="-1"/>
    <description>You see a root of mandragora. It has medicinal properties, if the right person uses it.</description>
    <implementation class-name="games.stendhal.server.entity.item.StackableItem"/>    <attributes>
      <quantity value="1"/>
    </attributes>
    <weight value="0.01"/>
    <value value="1"/>
    <equipable>
      <slot name="lhand"/>
      <slot name="rhand"/>
      <slot name="bag"/>
      <slot name="trade"/>
    </equipable>
  </item>

  <item name="sclaria">
    <type class="herb" subclass="sclaria" tileid="-1"/>
    <description>You see the herb sclaria. The smell is calming.</description>
    <implementation class-name="games.stendhal.server.entity.item.StackableItem"/>    <attributes>
      <quantity value="1"/>
    </attributes>
    <weight value="0.01"/>
    <value value="1"/>
    <equipable>
      <slot name="lhand"/>
      <slot name="rhand"/>
      <slot name="bag"/>
      <slot name="trade"/>
    </equipable>
  </item>

</items>
