<?xml version="1.0" encoding="UTF-8" standalone="no"?>

<items xmlns="stendhal" xmlns:xsi="http://www.w3.org/2001/XMLSchema-instance"
		xsi:schemaLocation="stendhal ../items.xsd">

	<item name="picture in wooden frame">
		<type class="furniture" subclass="picture_in_wooden_frame"/>
		<description>You see a picture in a wooden frame</description>
		<implementation class-name="games.stendhal.server.entity.item.ExaminableItem"/>
		<attributes>
			<quantity value="1"/>
			<max_quantity value="2147483647"/>
		</attributes>
		<weight value="1.0"/>
		<value value="1"/>
		<equipable>
			<slot name="ground"/>
			<slot name="content"/>
			<slot name="lhand"/>
			<slot name="rhand"/>
			<slot name="bag"/>
			<slot name="trade"/>
		</equipable>
	</item>
</items>
